No,Contents
1873,"QT @jesusmedinae: RT @isamg6: Esto es lo que viven nuestros hermanos venezolanos, una fuerza pública infiltrada por los criminales cubanos se degeneró en est… ; (Video) La GNB tortura con ""sadismo"" intentando penetrarle el trasero con una cabilla a un hombre más la paliza que le dan, muestras de violaciones a los DDHH en Venezuela. https://t.co/a3SpLEHS3y"
1874,"QT @EcoMineriaVE: RT @ClavelRangel: ¿Sabías que el Gobierno le compra oro a la delincuencia organizada que somete a humildes venezolanos para hacer parecer p… ; ¿Sabías que, en 2017, el Arco Minero del Orinoco aportó alrededor de 300 millones de euros a las reservas de la nación? Si te lo pasaste por alto, infórmate acá: https://t.co/D4cQiURQTL #VenezuelaEsInclusión y es conciencia de pueblo. https://t.co/WW0V7Fwu8u"
1876,"RT @TAMARA_SUJU: Epa @NicolasMaduro mira lo que te mandan a decir los Venezolanos que estan haciendo la campaña admirable por los paises andinos buscando simplemente un pais que les garantice alimentos, medicina, seguridad y esperanzas de vida... 200 criminales que ostentan el poder .no son más https://t.co/5g4kjLkWuI"
1884,"QT @AlvaroUribeVel: A MI NO ME GUSTAN LAS HIJUEPUTAS GROSERÌAS BOQUISUCIA!!! https://t.co/J38WzUpS6m ; Lo muchachos venezolanos humillados por la dictadura y estos universitarios ansiosos de las cadenas. Una estudiante me gritaba palabra mayores, veía yo esa bella cara, tan Colombiana y dije con asombro, por qué boquisucia!"
1885,RT @Mr_Chimbi: @MojiconFuicioso Acá en Medellin no hacen sino atracar y traer enfermedades esos hijueputas venecos de mierda!!
1890,RT @petrogustavo: La investigación sobre el atentado de Cúcuta se evade si se queda en los ciudadanos venezolanos a los que pagaron para destruir una manifestación que el alcalde de la ciudad decidió inconstitucionalmente impedir. Los planificadores de ese delito son altos dirigentes de Cúcuta.
1894,RT @PadreJosePalmar: El narco general Padrino López se opone al canal humanitario dejando a la merced del hambre a millones de venezolanos. Ese delito de lesa humanidad lo califica para ser encarcelado por treinta años y como pecado lo tendrá que pagar muy caro en el infierno. Es un genocida atroz. https://t.co/pv1DMPevwl
1895,"RT @MojiconFuicioso: No les den plata a esos hijueputas venezolanos que solo vienen a robar, ignorelos, mírelos con desprecio y asco, no les compre ni mierda y si puede escúpalos o golpeelos."
1896,"QT @ADNapolo: Qué los deportes a todos, inicien por los odiosos Venecos de Cedritos. https://t.co/hEuXcDH84K ; Qué peligro estos venecos a eso vienen a Colombia 🇨🇴 https://t.co/KK4OARZDb0"
1899,"No maricas, es que en serio, referirse a las venezolanas como si todas fueran putas en el momento histórico por el que están pasando es feo, cambien eso."
1908,"Debemos impulsar acciones contundentes, que la opinion pública no pueda pasar por alto como noticia, ojo, que no sean bombazos ni, masacres ni venecos utilizados para campañas políticas, en eso ya nos ganaron las ratas del Cd."
1924,"RT @alcaldeledezma: La Encuesta de Condiciones de Vida, reveló que la pobreza extrema aumentó en el país de 23,6 a 61,2% en solo cuatro años. El 80% de los hogares presenta inseguridad alimentaria y 8,2 millones de venezolanos ingieren dos o menos comidas al día. la solución: ¿elecciones chimbas? NO https://t.co/a2HhvCzi3T"
1925,Yo no vuelvo a contratar venezolanos: esos hijueputas son re malagradecidos esos malparidos. Con ese paso ilegal de venezolanos en la frontera y ninguno ha pisado una mina de las Farc
1942,"RT @tmaniglia: CRUDA VERDAD-2 @NicolasMaduro ""Es indignante ver cómo nos roban los billetes, hacemos tremenda inversión para editarlos en la Casa de la Moneda venezolana, en el exterior y se los están llevando para Cúcuta, ¡bandidos, ladrones!... PEEERO no van a poder con nosotros"" https://t.co/gCe1APhAyF"
1945,"RT @rubenzuleta: En las Trochas ""La Carbonera y 51"" Vía boconó - Escobal @PoliciaCucuta capturo 2 hombres venezolanos por el delito de favorecimiento ilícito al contrabando, a quienes se les halló 220 galones de gasolina venezolana e inmovilizo 2 vehículos. https://t.co/4npHeS1GiP"
1947,"@CanalCapital @TransMilenio estacion av cali flores 76,72 dejan COLAR avendedores ambulantes cantantes los que piden QUE SON LOS MISMMOS LADRONES o es que ahi una mafia ahi? por que los venezolanos ya andan en manadas a vender a cantar y los otros a robar sacan cuchillos pistolas y uno ve que los policias"
1950,"RT @SContrerasB: Exilio venezolano espera que con medida de ACNUR no deporten a ningún venezolano. ""Esperamos que esto sirva para que, los venezolanos que no tienen estatus migratorio no sean deportados de EE.UU hacia Venezuela, donde sus vidas correrían peligro"" https://t.co/pVtzgXgARX"
1961,RT @ExtraCali: Brutal atraco de muerte en Mosquera: venezolanos le propinaron 15 atroces puñaladas https://t.co/O3UujLtzB7
1970,"RT @OlgaLucaCotamo: Ante cierre fronterizo, algunos venezolanos y colombianos deciden pasar por las trochas y río Táchira, 30 mil pesos pagan a bandas criminales"
1978,"@carlosfgalan La pregunta es: qué putas tenemos que ver con Venezuela.? Deje que los venezolanos arreglen su país, si pueden y nosotros tratemos de arreglar el nuestro si es que podemos.."
1979,"RT @TAMARA_SUJU: Epa @NicolasMaduro mira lo que te mandan a decir los Venezolanos que estan haciendo la campaña admirable por los paises andinos buscando simplemente un pais que les garantice alimentos, medicina, seguridad y esperanzas de vida... 200 criminales que ostentan el poder .no son más https://t.co/5g4kjLkWuI"
1981,QT @Libasky_S: Parranda de hijueputas! https://t.co/oMIhf7JP64 ; Me enoja ver como han publicado tantas cosas de la foto de la venezolana que se esfuerza por llevar a casa algo de dinero y la gente se va es por el cuerpo solo porque en la foto se le ve la cara bonita 😒.
1987,RT @petrogustavo: La investigación sobre el atentado de Cúcuta se evade si se queda en los ciudadanos venezolanos a los que pagaron para destruir una manifestación que el alcalde de la ciudad decidió inconstitucionalmente impedir. Los planificadores de ese delito son altos dirigentes de Cúcuta.
1994,RT @petrogustavo: La investigación sobre el atentado de Cúcuta se evade si se queda en los ciudadanos venezolanos a los que pagaron para destruir una manifestación que el alcalde de la ciudad decidió inconstitucionalmente impedir. Los planificadores de ese delito son altos dirigentes de Cúcuta.
1998,"@Ruben_sote @arboroa2014 @FuriaRojaTV @CaliWebCo uy si que chimba ver venezolanos robando a todo hp momento, jajaja ya hay mas ladrones venecos que propios caleños, en mi barrio los mantinen cogiendo, y los deportan para venezuela, bien merecido"
2004,"RT @Andy0325Diego: Esa fama de putas que se ganaron las venezolanas ya no se la pueden quitar, eso pasa como con los colombianos, esa fama de narcotraficantes y ladrones la llevamos impregnada."
2005,RT @rauljulialevy: Hermanos Venezolanos no solo en Venezuela se cuecen habas en Monclova Coahuila unos sujetos de una gasolinera los bañaron con gasolina y le prendieron lumbre ofrezco Mil Dólares por quien nos de la información de estos HDP criminales Mexico lider mundial en salvajismo animal https://t.co/wUJ6Hek3aa
2006,"QT @Hecosw: RT @rweisshaar: No olvidar el vil asesinato cometido por la dictadura chavista contra 7 rebeldes que se habían rendido y dispuestos a entre… ; El incidente mas grave ocurrió el 6D1998. Ahí arrancó la formación miserable que hoy vive nuestro país. Además ha habido otros mas graves el 11Abril2002, 13A2002, desde 2013 al 2017 ¿cuantos asesinatos por delincuencia y fusilamientos a venezolanos en las calles y por protestas? https://t.co/4yyOaRv3ra"
2008,RT @botellazo: Esta fase q estamos sufriendo los venezolanos será conocida en la historia como el Hamponato. País sometido por la delincuencia organizada
2017,"RT @delsasolorzano: Toda mi admiración a los médicos venezolanos, quienes sin medicinas e insumos, con los peores sueldos del mundo y sorteando incluso la inseguridad en los hospitales, siguen atendiendo a los pacientes en Vzla #DiaDelMedico"
2020,"RT @TAMARA_SUJU: Epa @NicolasMaduro mira lo que te mandan a decir los Venezolanos que estan haciendo la campaña admirable por los paises andinos buscando simplemente un pais que les garantice alimentos, medicina, seguridad y esperanzas de vida... 200 criminales que ostentan el poder .no son más https://t.co/5g4kjLkWuI"
2023,RT @arboroa2014: Muchos se han incomodado por mis trinos serios y objetivos. Cuando dije lo de los Venezolanos no estaba equivocado. Dije muy claro que NO tengo nada en contra de ellos. Dije además que la llegada de ellos a Colombia esta disparando la delincuencia.
2025,RT @VignoloArmando: @atvmasnoticias Hay que poner un alto a los venecos han venido ladrones asesinos
2035,Ladrones en @unicentrvillavo nacionalidad #venezolanos. Identifique las nuevas caras de la delincuencia y no confíe en nadie. @deVillavicencio @VillavoTurismo @EnterateVillavo @VillavoAlcaldia https://t.co/GcovgmwE8g
2037,RT @petrogustavo: La investigación sobre el atentado de Cúcuta se evade si se queda en los ciudadanos venezolanos a los que pagaron para destruir una manifestación que el alcalde de la ciudad decidió inconstitucionalmente impedir. Los planificadores de ese delito son altos dirigentes de Cúcuta.
2041,"🔴 #ENVIVO | “La inseguridad es tan terrible que no puedes salir de tu casa”: Reymar Perdomo, la cantante venezolana presenta su canción ‘Me fui’, el tema con el que muestra el dolor de los emigrantes de su país https://t.co/8Ow2EqJ06o https://t.co/Sx6BxFRLBw"
2048,"RT @SoyVenezuela: Vivir con tu familia sin q alguno deba emigrar, hacer una vida normal sin miedo a la delincuencia,libertad de comer lo que desees,tener efectivo o transporte público,adquirir un carro y hasta un teléfono:eso quitó el socialismo a los venezolanos. Por eso #ColombiaNoTeEquivoques https://t.co/QLsxXvRD1F"
2054,"QT @CarlosAMontaner: RT @DomingoPaniza: Porque @JuanManSantos ha sido el peor Presidente de la historia reciente de #Colombia. Si fue capaz de robarse un Plebis… ; ¿Por qué Juan Manuel Santos les entregó dos estudiantes venezolanos asilados en Colombia a la policía política chavista? Sabía que los torturarían. Además de un delito, JMS cometió una canallada imperdonable."
2056,"RT @alcaldeledezma: ¿ministro? Reverol ""anuncia nuevo plan contra robo de vehículos"". El mejor plan es que se vayan definitivamente, porque son esas bandas delincuencia que ellos organizan y amparan, las que atentan contra la vida y los bienes de los venezolanos. https://t.co/x8hqEkbWmN"
2060,"¿De dónde eres? Epale mi pana Yo Soy Venezolano Ahhhh... Corrupción, Cocaína, Traficantes, Escasez, hambre miseria. Delincuencia. y me imagino que tú eres adicto verdad?, además guarimbero Bachaquero,... https://t.co/ZuWOLOQ01g"
2075,Con todo el respeto que se merecen algunos conocidos me tienen mamado esos venecos y venecas catre hijueputas si no son cacorros son putas y creen que uno tiene que aguantarseles esa malparida actitud tan fastidiosa que tiene una gran mayoría
2076,@petrogustavo Esos venecos hablan por hablar y da rabia que esos canales caracol y rcn se centran en Venezuela pero no hablan del peligro de la dictadura del CD que se quiere imponer en Colombia.
2079,"Una divina venezolana nueva en la ciudad, ven y conóceme. #putas #Antioquia | https://t.co/TzvHzg6BXl https://t.co/fHvy2cirqo"
2082,"RT @CarlosAMontaner: ¿Por qué Juan Manuel Santos les entregó dos estudiantes venezolanos asilados en Colombia a la policía política chavista? Sabía que los torturarían. Además de un delito, JMS cometió una canallada imperdonable."
2093,Los venezolanos que apoyaban a Senegal: A MAMARLA HIJUEPUTAS y a seguir pasando hambre
2106,"QT @DanielBlancoPz: RT @adri_loureiro_f: YA VA. La mitad de TODA Venezuela fue robada el año pasado. Tómense un segundo para procesar. #EstoNoEsNormal https:… ; Gallup Survey: Aproximadamente la mitad de los venezolanos fueron robados durante el año pasado, un cuarto de la población fue agredida durante un atraco y menos del veinte por ciento se siente seguro en las noches. Solo una minoría confía en las fuerzas de seguridad."
2109,QT @nelsonbocaranda: RT @PadreJosePalmar: Gracias a Dios que nuestro colega Nelson Bocaranda salió ileso y sano físicamente del atraco a mano armada. De seguro… ; Lamentablemente hoy soy parte de esa estadística de venezolanos afectados por la criminalidad y la violencia al haber sufrido un atraco a mano armada. Gracias por sus mensajes y apoyo. Estoy bien.
2114,Nuestros hermanos Colombovenezolanos y Venezolanos que han tenido que padecer la tragedia en la que los sumió el populismo hoy dan testimonio ante el mundo y nos advierten del peligro que corre nuestra democracia.... https://t.co/fjjIPRl8vq
2115,"@portu73ccs @Yeimy_Valentina Se creen con moral de darnos lecciones estos fracasados con resentimiento ante la impotencia de no poder hacer nada y sólo vienen a joder a nuestro país. De mí parte que se desborde la xenofobia, se la merecen ratas venezolanas"
2118,"RT @CarlosAMontaner: ¿Por qué Juan Manuel Santos les entregó dos estudiantes venezolanos asilados en Colombia a la policía política chavista? Sabía que los torturarían. Además de un delito, JMS cometió una canallada imperdonable."
2120,"QT @CarlosAMontaner: Pero si esos muchachos fueran de izquierda, ustedes dirían exactamente lo contrario https://t.co/uugDR6cSYN ; ¿Por qué Juan Manuel Santos les entregó dos estudiantes venezolanos asilados en Colombia a la policía política chavista? Sabía que los torturarían. Además de un delito, JMS cometió una canallada imperdonable."
2123,@PGN_COL que responsabilidad le cabe a @MigracionCol que permite pasó de venezolanos indocumentados a llenar las calles de miseria y delincuencia? Denunció incumplimiento de obligaciones de ley
2124,"RT @miguelale: Oiste: La familia Santos odia a Estados Unidos y ama a Cuba y a los gobernantes cubanos. pero: Hijos, primos, sobrinos y yernos viven en el imperio americano o desean irse para el imperio británico. !Que hijueputas criminales tan Venezolanos!"
2126,@PachoSantosC A que horas salen vuelos el lunes para Miami? Es para ir a el Aeropuerto a ver como corren las ratas a reunirsen con sus pares venecos...
2128,"QT @Dani_Matamoros: RT @ponchohd: Mexicanos al grito de guerra, les aviento a este güey! Bienvenido a tren del mame! https://t.co/rsqkXqqwdg ; Ahora quién se aguanta a esos pinches frijoleros jodiendo por ese puto triunfo contra Alemania... Están peor o igual que los venezolanos jodiendo por esas putas arepas..."
2129,"RT @idalmac46: Socialistas y Comunistas se han puesto de acuerdo, para que PODEMOS se haga cargo de la RTVE. Por más que nos han advertido nuestros hermanos venezolanos, parece que aún algunos no han visto el peligro que supone el CHAVISMO. Esperemos que el Parlamento no caiga en la trampa. https://t.co/GiBc72KdqR"
2133,"RT @CarlosAMontaner: ¿Por qué Juan Manuel Santos les entregó dos estudiantes venezolanos asilados en Colombia a la policía política chavista? Sabía que los torturarían. Además de un delito, JMS cometió una canallada imperdonable."
2136,"RT @CarlosAMontaner: ¿Por qué Juan Manuel Santos les entregó dos estudiantes venezolanos asilados en Colombia a la policía política chavista? Sabía que los torturarían. Además de un delito, JMS cometió una canallada imperdonable."
2140,Y los hijueputas Venezolanos que hacen opinando?
2142,"RT @CarlosAMontaner: ¿Por qué Juan Manuel Santos les entregó dos estudiantes venezolanos asilados en Colombia a la policía política chavista? Sabía que los torturarían. Además de un delito, JMS cometió una canallada imperdonable."
2145,"RT @OlgaLucaCotamo: Colombianos que viven en Venezuela y venezolanos hijos de colombianos atraviesan la frontera por las trochas para votar, denuncian que por San Antonio la guerrilla venezolana les cobra entre 30 y 50 mil pesos y por Ureña lo realizan las bandas criminales."
2146,"RT @CarlosAMontaner: ¿Por qué Juan Manuel Santos les entregó dos estudiantes venezolanos asilados en Colombia a la policía política chavista? Sabía que los torturarían. Además de un delito, JMS cometió una canallada imperdonable."
2149,RT @ThaniaVegaCD: #DuquePresidente “El que no conoce su historia tiende a repetirla como nos pasó a nosotros los venezolanos”. ciudadanos venezolanos alertan del peligro que representa un comunista en el poder como el dictador @NicolasMaduro https://t.co/iBkPtuYgui
2158,RT @ThaniaVegaCD: #DuquePresidente “El que no conoce su historia tiende a repetirla como nos pasó a nosotros los venezolanos”. ciudadanos venezolanos alertan del peligro que representa un comunista en el poder como el dictador @NicolasMaduro https://t.co/iBkPtuYgui
2163,"RT @CarlosAMontaner: ¿Por qué Juan Manuel Santos les entregó dos estudiantes venezolanos asilados en Colombia a la policía política chavista? Sabía que los torturarían. Además de un delito, JMS cometió una canallada imperdonable."
2165,"RT @CarlosAMontaner: ¿Por qué Juan Manuel Santos les entregó dos estudiantes venezolanos asilados en Colombia a la policía política chavista? Sabía que los torturarían. Además de un delito, JMS cometió una canallada imperdonable."
2167,@MariaFdaCabal @montanertwiter La mejor forma de apoyar a nuestros hermanos venezolanos es votar por @IvanDuque necesitamos alguien que ayude a expulsar a esos corruptos del poder colombia es clave para la libertad de Venezuela
2169,QT @_mxtvv: Ya me tienen mamada. https://t.co/IUejoDvBz4 ; gran hijueputas venecos re malparidos
2171,"@loveisapxlaroid Nuestra economía no da para mas personas, el sistema de salud es un caos ahora imaginar para mas personas, la inseguridad en Colombia es alta en muchas ciudades y tener mas molesta bastante, ademas los Venezolanos tienen cierto disgusto con nosotros+"
2179,"RT @CarlosAMontaner: ¿Por qué Juan Manuel Santos les entregó dos estudiantes venezolanos asilados en Colombia a la policía política chavista? Sabía que los torturarían. Además de un delito, JMS cometió una canallada imperdonable."
2182,"QT @HassNassar: Ante elección por parte de @Registraduria con ayuda de la votación colombo/venezolana, de DELINCUENTES/CRIMINALES, Es natural,que suceda esto de parte de PERSONAS DIGNAS, HUMILDES, HONESTAS y TRABAJADORAS: https://t.co/FEUMKMG8Uz ; Nada más triste que un ganador con soberbia desmedida o un mal perdedor incapaz de reconocer el triunfo ajeno con altura."
2191,RT @ThaniaVegaCD: #DuquePresidente “El que no conoce su historia tiende a repetirla como nos pasó a nosotros los venezolanos”. ciudadanos venezolanos alertan del peligro que representa un comunista en el poder como el dictador @NicolasMaduro https://t.co/iBkPtuYgui
2194,RT @ThaniaVegaCD: #DuquePresidente “El que no conoce su historia tiende a repetirla como nos pasó a nosotros los venezolanos”. ciudadanos venezolanos alertan del peligro que representa un comunista en el poder como el dictador @NicolasMaduro https://t.co/iBkPtuYgui
2198,QT @Dani_Matamoros: RT @odiomistweets: Alguien por favor ponga en su luga a este remedo de periodista. https://t.co/zfKctBZujU ; Ahora quién se aguanta a esos pinches frijoleros jodiendo por ese puto triunfo contra Alemania... Están peor o igual que los venezolanos jodiendo por esas putas arepas...
2200,"RT @CarlosAMontaner: ¿Por qué Juan Manuel Santos les entregó dos estudiantes venezolanos asilados en Colombia a la policía política chavista? Sabía que los torturarían. Además de un delito, JMS cometió una canallada imperdonable."
2201,"RT @CarlosAMontaner: ¿Por qué Juan Manuel Santos les entregó dos estudiantes venezolanos asilados en Colombia a la policía política chavista? Sabía que los torturarían. Además de un delito, JMS cometió una canallada imperdonable."
2202,RT @mayuinforma: Asi mueren nuestros hermanos venezolanos por falta de alimentos y medicinas Delito de Lesa Humanidad que son tapados por @Pontifex_es @ONU_es @ONU_derechos y @NicolasMaduro @NoticiasVenezue @NTN24ve @IvanDuque @AlvaroUribeVel @EdwBallesteros @comunidadenline https://t.co/yOMRYlONIx
2206,@elestudiado @MariaCorinaYA seran perseguidos como ratas los venecos no los queremos en ningun pais
2214,"RT @CarlosAMontaner: ¿Por qué Juan Manuel Santos les entregó dos estudiantes venezolanos asilados en Colombia a la policía política chavista? Sabía que los torturarían. Además de un delito, JMS cometió una canallada imperdonable."
2216,"RT @CarlosAMontaner: ¿Por qué Juan Manuel Santos les entregó dos estudiantes venezolanos asilados en Colombia a la policía política chavista? Sabía que los torturarían. Además de un delito, JMS cometió una canallada imperdonable."
2220,"QT @CarlosAMontaner: RT @pachoaristi: Cuando caiga @NicolasMaduro @LORENT_SALEH quedará libre y habiendo leído un poco sobre él, tengo certeza que denunciará in… ; ¿Por qué Juan Manuel Santos les entregó dos estudiantes venezolanos asilados en Colombia a la policía política chavista? Sabía que los torturarían. Además de un delito, JMS cometió una canallada imperdonable."
2221,"QT @CarlosAMontaner: RT @DomingoPaniza: Porque @JuanManSantos ha sido el peor Presidente de la historia reciente de #Colombia. Si fue capaz de robarse un Plebis… ; ¿Por qué Juan Manuel Santos les entregó dos estudiantes venezolanos asilados en Colombia a la policía política chavista? Sabía que los torturarían. Además de un delito, JMS cometió una canallada imperdonable."
2222,"RT @SoyVenezuela: Vivir con tu familia sin q alguno deba emigrar, hacer una vida normal sin miedo a la delincuencia,libertad de comer lo que desees,tener efectivo o transporte público,adquirir un carro y hasta un teléfono:eso quitó el socialismo a los venezolanos. Por eso #ColombiaNoTeEquivoques https://t.co/QLsxXvRD1F"
2230,"Retweeted Carlos A. Montaner (@CarlosAMontaner): ¿Por qué Juan Manuel Santos les entregó dos estudiantes venezolanos asilados en Colombia a la policía política chavista? Sabía que los torturarían. Además de un delito, JMS cometió una canallada imperdonable."
2234,"RT @AlbertoRodNews: La exmiss venezolana Mariana Pares fue arrestada en Viena, Austria, por liderar red de trata de mujeres. Pares ofrecía a jóvenes ayudarlas a “trabajar” ofreciéndoles trabajo pero al llegar Viena, les quitaban sus pasaportes y las promocionaban como prostitutas y “escorts VIP” https://t.co/1QvWwKCSKX"
2235,"QT @MafeCarrascal: RT @GiuseppeNoc: Los venezolanos en todo el mundo, con la experiencia adquirida, tratan de alertar el peligro del socialismo y sobre todo d… ; Saliendo de Fontibón en un TransMilenio iba con algunos jóvenes de @PaisPrimero. Se subió un venezolano, no a vender productos, sino a vendernos miedo, que el 27 votemos para no ser como Venezuela. Lo interpelé, le dije que bienvenidos pero que nos respetaran. No más miedo."
2236,"QT @CarlosAMontaner: RT @pachoaristi: Cuando caiga @NicolasMaduro @LORENT_SALEH quedará libre y habiendo leído un poco sobre él, tengo certeza que denunciará in… ; ¿Por qué Juan Manuel Santos les entregó dos estudiantes venezolanos asilados en Colombia a la policía política chavista? Sabía que los torturarían. Además de un delito, JMS cometió una canallada imperdonable."
2237,Queremos conocer venezolanas #venecas #venezolanas #putas #embarazada #arrecha
2240,"RT @NoticiasRCN: Vicepresidente de EE.UU, Mike Pence, pidió a países miembros de la OEA que voten para expulsar a Venezuela del organismo, con el fin de devolver la ""libertad"" a los venezolanos https://t.co/BXPS3y0hKi https://t.co/YlvbjyvYt4"
2250,"RT @CarlosAMontaner: ¿Por qué Juan Manuel Santos les entregó dos estudiantes venezolanos asilados en Colombia a la policía política chavista? Sabía que los torturarían. Además de un delito, JMS cometió una canallada imperdonable."
2255,"RT @TAJODE: Así veo a la ""oposición"" venezolana. Ratas que salieron de la misma alcantarilla que los criminales del PSUV. Ningún político está haciendo lo debido para salir del sistema, todos trabajan para mantenerlo. Están llenando sus arcas a cambio de la muerte de miles de venezolanos. https://t.co/CthSaDNfJd"
2256,"RT @CarlosAMontaner: ¿Por qué Juan Manuel Santos les entregó dos estudiantes venezolanos asilados en Colombia a la policía política chavista? Sabía que los torturarían. Además de un delito, JMS cometió una canallada imperdonable."
2261,"RT @CarlosAMontaner: ¿Por qué Juan Manuel Santos les entregó dos estudiantes venezolanos asilados en Colombia a la policía política chavista? Sabía que los torturarían. Además de un delito, JMS cometió una canallada imperdonable."
2263,"RT @NoticiasRCN: Vicepresidente de EE.UU, Mike Pence, pidió a países miembros de la OEA que voten para expulsar a Venezuela del organismo, con el fin de devolver la ""libertad"" a los venezolanos https://t.co/BXPS3y0hKi https://t.co/YlvbjyvYt4"
2267,Peligro en la frontera: Mafias venezolanas trafican indocumentados en Colombia https://t.co/4QUlEd0sf2
2269,"RT @CarlosAMontaner: ¿Por qué Juan Manuel Santos les entregó dos estudiantes venezolanos asilados en Colombia a la policía política chavista? Sabía que los torturarían. Además de un delito, JMS cometió una canallada imperdonable."
2270,"RT @CarlosAMontaner: ¿Por qué Juan Manuel Santos les entregó dos estudiantes venezolanos asilados en Colombia a la policía política chavista? Sabía que los torturarían. Además de un delito, JMS cometió una canallada imperdonable."
