No,Contents
3534,RT @Popeye_leyenda: Los Comunistas como Iván Cepeda siempre se disfrazan de defensores de derechos humanos. Pero cuando toman el poder. Se convierten en los peores violadores de loa derechos humanos. Si no me creen miren hacia el Pueblo Venezolano. Todos sus derechos fueron violentado. Comunismo
3535,"RT @mluciaramirez: Durante estos días recorriendo los departamentos de El Cesar Magdalena y Atlántico corroboro la necesidad urgente de aumentar el pie de fuerza de la policía Nacional. El aumento del desempleo, la migración venezolana y microtráfico aumentan la inseguridad."
3543,"QT @CODHESColombia: Para tener en cuenta. Debemos ser coherentes y responsables con el país, estudiar el fracaso del modelo económico otros países y no repetir. https://t.co/kw2168yCxm ; #TeDoyLaBienvenidaCIDHAudiencias ¿Por qué migran los venezolanos? ""Según estudio de la @OIMSuramerica en Ecuador y Perú, las principales razones para migrar son de carácter económico, la falta de empleo, violencia e inseguridad y falta de alimentos y medicamentos"""
3545,RT @EIExpedienteCol: Dato: @AlvaroUribeVel informa que el gobierno le informó de un plan para asesinarlo en el que estarían involucrados 'criminales locales y extranjeros'. Se refiere a esta denuncia que involucra a funcionarios de la embajada venezolana y al agente cubano Efraín Russ. https://t.co/qLd3bbhpPv
3551,"RT @ejrl: Justo ahora caen sobre Venezuela y los venezolanos las consecuencias de las expropiaciones que ejecutó el irresponsable eterno y supremo, el jefe de los ladrones."
3570,RT @EIExpedienteCol: Dato: @AlvaroUribeVel informa que el gobierno le informó de un plan para asesinarlo en el que estarían involucrados 'criminales locales y extranjeros'. Se refiere a esta denuncia que involucra a funcionarios de la embajada venezolana y al agente cubano Efraín Russ. https://t.co/qLd3bbhpPv
3577,"RT @LakpuchaC2: Venezuela está como está no solo por el gobierno q manda y dicta , si no también por los mismos venezolanos que se volvieron chanchuyeros, ladrones y aprovechadores, hagamos el cambio de país, pero 1ero desde nosotros..."
3587,RT @EIExpedienteCol: Dato: @AlvaroUribeVel informa que el gobierno le informó de un plan para asesinarlo en el que estarían involucrados 'criminales locales y extranjeros'. Se refiere a esta denuncia que involucra a funcionarios de la embajada venezolana y al agente cubano Efraín Russ. https://t.co/qLd3bbhpPv
3592,RT @EIExpedienteCol: Dato: @AlvaroUribeVel informa que el gobierno le informó de un plan para asesinarlo en el que estarían involucrados 'criminales locales y extranjeros'. Se refiere a esta denuncia que involucra a funcionarios de la embajada venezolana y al agente cubano Efraín Russ. https://t.co/qLd3bbhpPv
3594,QT @carlosfgalan: RT @etbnuestra: En un posible Gobierno de @ivanduque se implementaría una reforma a la justicia aún peor que la venezolana #CastroChavismo… ; El uribismo propone q el Presidente nombre directamente al Fiscal General sin que medie la Corte Suprema y q también supla vacancias de Magistrados del “Tribunal Constitucional Supremo”. Todo el poder para el Presidente. Qué peligro! https://t.co/isFGc7dZwZ via @elespectador
3599,"@jorgeramosnews Lo mismo pasa con los venezolanos, son tratados como criminales en el aeropuerto. Doble moral"
3604,"@annyperezg @patriciajaniot @UniNoticias @petrogustavo Viene a opinar sobre Colombia cuando los Venezolanos no pudieron sacar a un dictador del poder. Simon Bolivar ha de estar revolcándose en su tumba, dejo un legado de cobardía donde prefieren correr y esconderse como ratas que ponerse a pelear contra la dictadura. Lamentable."
3611,"@rudolph_s_a Tiene razón, lo peor es ver como muchos se refieren a las venezolanas, de pre pago prostitutas, y así por el estilo. Se olvidan que en tiempos de crisis allá tendieron la mano a muchos de nuestros compatriotas sin decir nada."
3620,RT @EIExpedienteCol: Dato: @AlvaroUribeVel informa que el gobierno le informó de un plan para asesinarlo en el que estarían involucrados 'criminales locales y extranjeros'. Se refiere a esta denuncia que involucra a funcionarios de la embajada venezolana y al agente cubano Efraín Russ. https://t.co/qLd3bbhpPv
3625,"@PresidencialVen @NicolasMaduro “Aunque el pueblo no vote este 20 de Mayo, tengo preparadas las mafias que han robado a los venezolanos. He arreciado la guerra en contra del Pueblo porque estamos en campaña presidencial, espero que el peso de la ley no llegue a mis ladrones” manifestó Dictador @NicolasMaduro"
3627,RT @EIExpedienteCol: Dato: @AlvaroUribeVel informa que el gobierno le informó de un plan para asesinarlo en el que estarían involucrados 'criminales locales y extranjeros'. Se refiere a esta denuncia que involucra a funcionarios de la embajada venezolana y al agente cubano Efraín Russ. https://t.co/qLd3bbhpPv
3628,"RT @FValenciaCossio: JEP extralimitó sus funciones en el caso Santrich,solo debe verificar si delito de narcotrafico se ejecutó después del acuerdo Santos -farc, lo demás es competencia de justicia ordinaria. Se violá una vez más la constitución y la ley. Dios nos libre de la copia a la venezolana."
3631,RT @EIExpedienteCol: Dato: @AlvaroUribeVel informa que el gobierno le informó de un plan para asesinarlo en el que estarían involucrados 'criminales locales y extranjeros'. Se refiere a esta denuncia que involucra a funcionarios de la embajada venezolana y al agente cubano Efraín Russ. https://t.co/qLd3bbhpPv
3633,"RT @mluciaramirez: Durante estos días recorriendo los departamentos de El Cesar Magdalena y Atlántico corroboro la necesidad urgente de aumentar el pie de fuerza de la policía Nacional. El aumento del desempleo, la migración venezolana y microtráfico aumentan la inseguridad."
3649,RT @Popeye_leyenda: Los Comunistas como Iván Cepeda siempre se disfrazan de defensores de derechos humanos. Pero cuando toman el poder. Se convierten en los peores violadores de loa derechos humanos. Si no me creen miren hacia el Pueblo Venezolano. Todos sus derechos fueron violentado. Comunismo
3650,QT @EIExpedienteCol: RT @nesvi50: Por qué la Fiscalía permanece con ese silencio sepulcral ante este proyecto macabro de la izquierda violenta que odia a Uribe… ; Dato: @AlvaroUribeVel informa que el gobierno le informó de un plan para asesinarlo en el que estarían involucrados 'criminales locales y extranjeros'. Se refiere a esta denuncia que involucra a funcionarios de la embajada venezolana y al agente cubano Efraín Russ. https://t.co/qLd3bbhpPv
3660,@stayjiaer Vivo en un pueblito y ya esta lleno de prostitutas venecas. No es ningún secreto.
3662,RT @EIExpedienteCol: Dato: @AlvaroUribeVel informa que el gobierno le informó de un plan para asesinarlo en el que estarían involucrados 'criminales locales y extranjeros'. Se refiere a esta denuncia que involucra a funcionarios de la embajada venezolana y al agente cubano Efraín Russ. https://t.co/qLd3bbhpPv
3664,RT @DonatellaDice: Hace ocho años se celebró un concierto en la frontera en Cúcuta entre Colombia y Venezuela donde todos estábamos pegados a los televisores y expresando apoyo entre los países. Hoy le llamamos “venecas” a las prostitutas... ¿Por qué tenemos corazón hipócrita los colombianos?
3667,"RT @mluciaramirez: Durante estos días recorriendo los departamentos de El Cesar Magdalena y Atlántico corroboro la necesidad urgente de aumentar el pie de fuerza de la policía Nacional. El aumento del desempleo, la migración venezolana y microtráfico aumentan la inseguridad."
3674,QT @EIExpedienteCol: RT @nesvi50: Por qué la Fiscalía permanece con ese silencio sepulcral ante este proyecto macabro de la izquierda violenta que odia a Uribe… ; Dato: @AlvaroUribeVel informa que el gobierno le informó de un plan para asesinarlo en el que estarían involucrados 'criminales locales y extranjeros'. Se refiere a esta denuncia que involucra a funcionarios de la embajada venezolana y al agente cubano Efraín Russ. https://t.co/qLd3bbhpPv
3682,"No solo es El NARCOTRÁFICO proveniente de #VENEZUELA, No solo El Holocausto y la inmigración del Venezolano, sino que además de las Violaciones a los DD.HH, está detrás un Narco Edo que APOYA al Terrorismo internac que pone en Peligro la Seguridad de EEUU y del Mundo."
3684,"RT @mluciaramirez: Durante estos días recorriendo los departamentos de El Cesar Magdalena y Atlántico corroboro la necesidad urgente de aumentar el pie de fuerza de la policía Nacional. El aumento del desempleo, la migración venezolana y microtráfico aumentan la inseguridad."
3690,RT @EIExpedienteCol: Dato: @AlvaroUribeVel informa que el gobierno le informó de un plan para asesinarlo en el que estarían involucrados 'criminales locales y extranjeros'. Se refiere a esta denuncia que involucra a funcionarios de la embajada venezolana y al agente cubano Efraín Russ. https://t.co/qLd3bbhpPv
3701,RT @EIExpedienteCol: Dato: @AlvaroUribeVel informa que el gobierno le informó de un plan para asesinarlo en el que estarían involucrados 'criminales locales y extranjeros'. Se refiere a esta denuncia que involucra a funcionarios de la embajada venezolana y al agente cubano Efraín Russ. https://t.co/qLd3bbhpPv
3709,"RT @ACNURamericas: El gobierno brasileño, apoyado por ACNUR y otras agencias, ha continuado la reubicación de venezolanos que viven en Roraima a otras partes de Brasil, después de que huyeron de la violencia, la falta de acceso a servicios básicos, inseguridad y temor a la persecución en Venezuela. https://t.co/7tQxOga4c6"
3714,"RT @mluciaramirez: Durante estos días recorriendo los departamentos de El Cesar Magdalena y Atlántico corroboro la necesidad urgente de aumentar el pie de fuerza de la policía Nacional. El aumento del desempleo, la migración venezolana y microtráfico aumentan la inseguridad."
3718,Personalmente ese cuento de que los venezolanos nunca se dieron cuenta de los ideales de extrema izquierda del chavismo no se lo cree el putas. Estaban muy ocupados disfrutando los regalos del gobierno y tanqueando las camionetas con esa gasolina más barata que una big cola.
3720,RT @EIExpedienteCol: Dato: @AlvaroUribeVel informa que el gobierno le informó de un plan para asesinarlo en el que estarían involucrados 'criminales locales y extranjeros'. Se refiere a esta denuncia que involucra a funcionarios de la embajada venezolana y al agente cubano Efraín Russ. https://t.co/qLd3bbhpPv
3721,RT @EIExpedienteCol: Dato: @AlvaroUribeVel informa que el gobierno le informó de un plan para asesinarlo en el que estarían involucrados 'criminales locales y extranjeros'. Se refiere a esta denuncia que involucra a funcionarios de la embajada venezolana y al agente cubano Efraín Russ. https://t.co/qLd3bbhpPv
3722,RT @EIExpedienteCol: Dato: @AlvaroUribeVel informa que el gobierno le informó de un plan para asesinarlo en el que estarían involucrados 'criminales locales y extranjeros'. Se refiere a esta denuncia que involucra a funcionarios de la embajada venezolana y al agente cubano Efraín Russ. https://t.co/qLd3bbhpPv
3723,"RT @AndrewsAbreu: #AHORA Tres venezolanos fueron condenados a 10 años de prisión por robar un teléfono celular en #Perú. Los implicados identificados como Oscar Romero, Nímber Arteaga y Dainer Yovera, fueron acusados del delito de robo agravado. https://t.co/MA6v7HbAF4"
3734,RT @EIExpedienteCol: Dato: @AlvaroUribeVel informa que el gobierno le informó de un plan para asesinarlo en el que estarían involucrados 'criminales locales y extranjeros'. Se refiere a esta denuncia que involucra a funcionarios de la embajada venezolana y al agente cubano Efraín Russ. https://t.co/qLd3bbhpPv
3735,"RT @rubenzuleta: En la manzana 13 barrio Cúcuta 75 #PoliciaCucuta Con #GOES Urbano capturó a Oscar Alberto Mendoza Páez, ciudadano #Venezolano, quien bajo intimidación con un arma neumática habría hurtado $800 mil pesos. Antecedentes por el mismo delito en hechos registrados en Venezuela. https://t.co/fsYg5YCw5S"
3738,"QT @EIExpedienteCol: De #estrategiaspoliticas y otras cosas no sabemos ... yo quiero , #laverdad https://t.co/l0ps0IqFlb ; Dato: @AlvaroUribeVel informa que el gobierno le informó de un plan para asesinarlo en el que estarían involucrados 'criminales locales y extranjeros'. Se refiere a esta denuncia que involucra a funcionarios de la embajada venezolana y al agente cubano Efraín Russ. https://t.co/qLd3bbhpPv"
3739,RT @Popeye_leyenda: Los Comunistas como Iván Cepeda siempre se disfrazan de defensores de derechos humanos. Pero cuando toman el poder. Se convierten en los peores violadores de loa derechos humanos. Si no me creen miren hacia el Pueblo Venezolano. Todos sus derechos fueron violentado. Comunismo
3746,RT @EIExpedienteCol: Dato: @AlvaroUribeVel informa que el gobierno le informó de un plan para asesinarlo en el que estarían involucrados 'criminales locales y extranjeros'. Se refiere a esta denuncia que involucra a funcionarios de la embajada venezolana y al agente cubano Efraín Russ. https://t.co/qLd3bbhpPv
3753,"@lortegadiaz @URosario Prepárense para la violencia armada contra ustedes, la gente se va a alzar contra los venezolanos; nadie va a tolerar una oleada de inmigrantes sin control robando los empleos nuestros y menos trayendo miseria, delincuencia y enfermedades. Ustedes perderán"
3759,"@NoticiasCaracol Tienen que ser venecos, todos sabemos las ratas que son."
3762,"Para mi la ""maldad"" era algo de películas, comics y superhéroes. A los venezolanos nos tocó vivirla, por culpa de una tanda de narcotraficantes criminales que por ignorantes dejamos montar en el gobierno. Ya poco importa si yo, o muchos nunca votamos por ellos 😣"
3764,"Burguesía venezolana, critican populismo madurita donde otorga dadivas al pueblo. Pero el entregarles las divisas a los poderosos, salvar bancos ladrones del patrimonio del pueblo, se aplaude. En fin, ese el dolor, no estar recibiendo hoy, lo q antes recibían también dádivas."
3765,"En la manzana 13 barrio Cúcuta 75 #PoliciaCucuta Con #GOES Urbano capturó a Oscar Alberto Mendoza Páez, ciudadano #Venezolano, quien bajo intimidación con un arma neumática habría hurtado $800 mil pesos. Antecedentes por el mismo delito en hechos registrados en Venezuela. https://t.co/39zzJ6V2sn"
3782,"RT @Gbastidas: Argentina, Brasil, Canadá, Chile, Colombia, Costa Rica, Guatemala, Guyana, Honduras, México, Panamá, Paraguay, Perú y Santa Lucía anuncian que van a intensificar y ampliar el intercambio de información de inteligencia financiera para sancionar a corruptos y criminales venezolanos"
3787,"QT @BluRadioCo: DOÑA LIGIA, NO OLVIDE LOS MILLONES DE COLOMBIANOS QUE NOS FUIMOS A VENEZUELA, A BUSCAR TRABAJO O POR EL PELIGRO DE LOS PARAS Y LA GUERRILLA. FUIMOS CASI CINCO MILLONES. https://t.co/nQ4w5nOBoi ; #AlAire Ligia Bolívar, socióloga, experta en temas migratorios, se refiere en #ElRadar a las cifras de venezolanos que han salido hacia Colombia en los últimos tiempos https://t.co/gLL37pdNGM"
3791,"RT @SergioNovelli: Sabemos que no todos los venezolanos que viven en Perú han obrado bien, pero comentarios como los que ha hecho el congresista de ese país, Rogelio Tucto, aseverando que la inseguridad en esa nación ha aumentado por la presencia de venezolanos, lo que origina es más xenofobia https://t.co/Kj35AyVJdg"
3797,@lafm Extranjeros plaga asquerosa venezolanos ratas inmundas
3798,"QT @cesarecolo: RT @Jeskaze: Valga aclarar que la gran mayoría de venezolanos que han llegado a Colombia en los últimos años son antiguos chavistas. Gente… ; Yo entiendo lo de ser solidarios y más con personas que nunca votaron por esos hijueputas, gente a la que sus mayores les cagaron la vida, pero ¿Ayudar a gente que, viendo cómo está su país en la ruina, sigue defendiendo a esos delincuentes? ¡Ni mierda!"
3802,RT @DolarToday: ¡PATRIA SANGRIENTA! La inseguridad sigue cobrando vidas de personalidades en las carreteras venezolanas #TeamHDP https://t.co/3S8pQ08h4e
3808,"RT @Beisbolpuro: El reporte del accidente en el que murieron los peloteros venezolanos José “Hacha” Castillo y Luis Valbuena, es que el automóvil en el que viajaban se estrelló contra una piedra en la carretera. Forma que los ladrones utilizan para bloquear el paso y asaltar https://t.co/gDWBX6syGz"
3811,"QT @Vicme100: RT @Carolicek: Me parece muy bien la sanción social que recibió @PiedadCordoba en Aruba de parte de unos venezolanos. Uno no puede andar d… ; Que peligro! Aquí el video de Piedad Cordoba exigiendo a los venezolanos hacer colas con gusto para no entorpecer el chavismo, hoy quiere ser Presidente de Colombia: https://t.co/LcNSi8rKyD"
3821,"@Citytv A deportar esas ratas, está dormido @IvanDuque con los venecos."
3829,"QT @Vicme100: RT @Carolicek: Me parece muy bien la sanción social que recibió @PiedadCordoba en Aruba de parte de unos venezolanos. Uno no puede andar d… ; Que peligro! Aquí el video de Piedad Cordoba exigiendo a los venezolanos hacer colas con gusto para no entorpecer el chavismo, hoy quiere ser Presidente de Colombia: https://t.co/LcNSi8rKyD"
3833,"QT @Vicme100: RT @Carolicek: Me parece muy bien la sanción social que recibió @PiedadCordoba en Aruba de parte de unos venezolanos. Uno no puede andar d… ; Que peligro! Aquí el video de Piedad Cordoba exigiendo a los venezolanos hacer colas con gusto para no entorpecer el chavismo, hoy quiere ser Presidente de Colombia: https://t.co/LcNSi8rKyD"
3835,"RT @cristiancrespoj: No es la caravana ""migrante"", aunque se le parece. Son venezolanos caminando por la Línea 2 del Metro de Caracas (Mamera) camino a Caricuao, producto de los constantes apagones generados por la ineficiencia y delincuencia de los narcotraficantes que tienen secuestrada a Venezuela https://t.co/fColfDx3B6"
3846,"RT @radamedina: Están matando a los Venezolanos que pueden ayudar a venezuela ser prospera de nuevo, lamentablemente estas noticias son a diario, famosos no famosos, todos son Venezolanos que tienen familia, la delincuencia hace lo que quiera si los agarran pagan 5 años y están fuera de nuevo. https://t.co/ghCYa0VvAP"
3851,"RT @rauljulialevy: Los Venezolanos nos advirtieron del gran riesgo y peligro que Mexico corría al elegir como presidente a otro miembro de la misma fraternidad, sus mentiras ya comenzaron a desmoronarse, hemos cometido los mexicanos un gran error y muy pronto lo verán, muy pronto lo lamentaran!"
3861,"RT @Vicme100: Que peligro! Aquí el video de Piedad Cordoba exigiendo a los venezolanos hacer colas con gusto para no entorpecer el chavismo, hoy quiere ser Presidente de Colombia: https://t.co/LcNSi8rKyD"
3873,"RT @SurielOpina: 10 venezolanos atacan de la manera más brutal a un adulto mayor, ya que éste señor les pidió a los extranjeros que, por favor, bajen el volumen de su música: estos hicieron caso omiso y en vez de llevar la fiesta en paz, pues adoptaron comportamientos francamente CRIMINALES https://t.co/nXUyweWlXD"
3880,"QT @Vicme100: RT @Carolicek: Me parece muy bien la sanción social que recibió @PiedadCordoba en Aruba de parte de unos venezolanos. Uno no puede andar d… ; Que peligro! Aquí el video de Piedad Cordoba exigiendo a los venezolanos hacer colas con gusto para no entorpecer el chavismo, hoy quiere ser Presidente de Colombia: https://t.co/LcNSi8rKyD"
3882,"RT @cristiancrespoj: No es la caravana ""migrante"", aunque se le parece. Son venezolanos caminando por la Línea 2 del Metro de Caracas (Mamera) camino a Caricuao, producto de los constantes apagones generados por la ineficiencia y delincuencia de los narcotraficantes que tienen secuestrada a Venezuela https://t.co/fColfDx3B6"
3883,"QT @Vicme100: RT @Carolicek: Me parece muy bien la sanción social que recibió @PiedadCordoba en Aruba de parte de unos venezolanos. Uno no puede andar d… ; Que peligro! Aquí el video de Piedad Cordoba exigiendo a los venezolanos hacer colas con gusto para no entorpecer el chavismo, hoy quiere ser Presidente de Colombia: https://t.co/LcNSi8rKyD"
3884,"QT @Canal1Colombia: Se Entiende La Situación Que Viven Los Venezolanos En Este Momento, Pero No Podemos Omitir Que También Con Su Llegada, La Tasa De Delincuencia Ha Aumentado, Atracan/Matan/Secuestran, Ect. ¿Acoger A Una Famalia Venezolana? Pues, Quien Nos Garantiza Nuestra Seguridad 🤷‍♂️ ; A propósito de un informe que tendremos este sábado, en #NoticiasUnoMediodía queremos preguntarte lo siguiente: ¿Acogerías en tu hogar a una familia venezolana? ¡Vota y comenta! Tus respuestas serán compartidas en nuestra emisión."
3887,@suriel @MartinVizcarraC Cárcel para todo Venezolano que cometa delito en Perú o en otro país y después que cumpla su pena debe ser deportado....tan sencillo como eso..
3888,"QT @Vicme100: RT @Carolicek: Me parece muy bien la sanción social que recibió @PiedadCordoba en Aruba de parte de unos venezolanos. Uno no puede andar d… ; Que peligro! Aquí el video de Piedad Cordoba exigiendo a los venezolanos hacer colas con gusto para no entorpecer el chavismo, hoy quiere ser Presidente de Colombia: https://t.co/LcNSi8rKyD"
3890,"RT @cristiancrespoj: No es la caravana ""migrante"", aunque se le parece. Son venezolanos caminando por la Línea 2 del Metro de Caracas (Mamera) camino a Caricuao, producto de los constantes apagones generados por la ineficiencia y delincuencia de los narcotraficantes que tienen secuestrada a Venezuela https://t.co/fColfDx3B6"
3898,"RT @Vicme100: Que peligro! Aquí el video de Piedad Cordoba exigiendo a los venezolanos hacer colas con gusto para no entorpecer el chavismo, hoy quiere ser Presidente de Colombia: https://t.co/LcNSi8rKyD"
3899,"RT @SurielOpina: 10 venezolanos atacan de la manera más brutal a un adulto mayor, ya que éste señor les pidió a los extranjeros que, por favor, bajen el volumen de su música: estos hicieron caso omiso y en vez de llevar la fiesta en paz, pues adoptaron comportamientos francamente CRIMINALES https://t.co/nXUyweWlXD"
3903,"QT @ColBolivariana: RT @Kukiman09: Que peligro este gobierno narcoparapoliticorrupto, que es capaz de enviar un helicóptero a disparar a la frontera venezolana… ; Guacho no les funcionó para tapar el escándalo Odebrecht. Ahora se están inventado autoatentados. Que le hace falta al Uribismo para caer en un círculo de estupidez del no retorno?"
3905,@AlegandroHoyos Parce carteleelo. Por esos malparidos es q de verdad los venecos q necesitan ayuda ya no les colaboran! Aca si somos es una manada de hijueputas oportunistas!
3910,"QT @cesarecolo: RT @Jeskaze: Valga aclarar que la gran mayoría de venezolanos que han llegado a Colombia en los últimos años son antiguos chavistas. Gente… ; Yo entiendo lo de ser solidarios y más con personas que nunca votaron por esos hijueputas, gente a la que sus mayores les cagaron la vida, pero ¿Ayudar a gente que, viendo cómo está su país en la ruina, sigue defendiendo a esos delincuentes? ¡Ni mierda!"
3914,RT @humbertotweets: La doble moral chavista es una tara que hay que expulsar del alma de la sociedad venezolana...
3920,"QT @cesarecolo: RT @Jeskaze: Valga aclarar que la gran mayoría de venezolanos que han llegado a Colombia en los últimos años son antiguos chavistas. Gente… ; Yo entiendo lo de ser solidarios y más con personas que nunca votaron por esos hijueputas, gente a la que sus mayores les cagaron la vida, pero ¿Ayudar a gente que, viendo cómo está su país en la ruina, sigue defendiendo a esos delincuentes? ¡Ni mierda!"
3929,"QT @Vicme100: RT @Carolicek: Me parece muy bien la sanción social que recibió @PiedadCordoba en Aruba de parte de unos venezolanos. Uno no puede andar d… ; Que peligro! Aquí el video de Piedad Cordoba exigiendo a los venezolanos hacer colas con gusto para no entorpecer el chavismo, hoy quiere ser Presidente de Colombia: https://t.co/LcNSi8rKyD"
3930,"RT @SurielOpina: 10 venezolanos atacan de la manera más brutal a un adulto mayor, ya que éste señor les pidió a los extranjeros que, por favor, bajen el volumen de su música: estos hicieron caso omiso y en vez de llevar la fiesta en paz, pues adoptaron comportamientos francamente CRIMINALES https://t.co/nXUyweWlXD"
3932,"QT @cristiancrespoj: RT @nanilike02: Tal cuál. Así esta Venezuela gracias al Socialismo, retrocedió al Siglo XIX. Vea pues señores los que quieren que los gobie… ; No es la caravana ""migrante"", aunque se le parece. Son venezolanos caminando por la Línea 2 del Metro de Caracas (Mamera) camino a Caricuao, producto de los constantes apagones generados por la ineficiencia y delincuencia de los narcotraficantes que tienen secuestrada a Venezuela https://t.co/fColfDx3B6"
3933,"RT @luchoceliscnai: Migración Colombia a detenido a Carlos Pino, ciudadano Venezolano, funcionario de la Embajada de Venezuela en Colombia, con familia Colombiana, por favor estar alertas, es posible que lo quieran expulsar, arbitrariedad total. @HOLLMANMORRIS @jerojasrodrigue @angelamrobledo"
3934,"RT @cristiancrespoj: No es la caravana ""migrante"", aunque se le parece. Son venezolanos caminando por la Línea 2 del Metro de Caracas (Mamera) camino a Caricuao, producto de los constantes apagones generados por la ineficiencia y delincuencia de los narcotraficantes que tienen secuestrada a Venezuela https://t.co/fColfDx3B6"
3947,@rafobrito16 @venezoIanos Venezolanos ladrones corruptos
3952,"QT @Vicme100: RT @Carolicek: Me parece muy bien la sanción social que recibió @PiedadCordoba en Aruba de parte de unos venezolanos. Uno no puede andar d… ; Que peligro! Aquí el video de Piedad Cordoba exigiendo a los venezolanos hacer colas con gusto para no entorpecer el chavismo, hoy quiere ser Presidente de Colombia: https://t.co/LcNSi8rKyD"
